exercise_id,name,category_tags,muscle_groups.primary,muscle_groups.secondary,equipment_required,location_compatible,contraindications,substitution_group,difficulty_level,instructions_text
ex_026,Burpees,"[""weight_loss"",""general_fitness""]","[""full_body""]","[""chest"",""quadriceps"",""core""]","[""none""]","[""gym"",""home"",""outdoors""]","[""knee"",""wrist"",""shoulder"",""lower_back""]",cardio_core,advanced,"From standing, squat down and place hands on the floor. Jump your feet back to a push-up position. Perform a push-up (optional), then jump feet back to your hands. Explode upward into a jump with arms overhead. Land softly and immediately go into the next rep."
ex_034,Leg Press,"[""strength"",""hypertrophy""]","[""quadriceps"",""glutes""]","[""hamstrings""]","[""machines""]","[""gym""]","[""knee""]",squat_pattern,beginner,Sit in the leg press machine with feet shoulder-width apart on the platform. Release the safety and lower the platform by bending your knees toward your chest. Press back up until legs are almost straight — don't lock out your knees. Keep your lower back pressed into the seat.
ex_044,Skull Crushers,"[""hypertrophy"",""strength""]","[""triceps""]",[],"[""barbell"",""bench""]","[""gym""]","[""wrist""]",tricep_isolation,intermediate,Lie on bench holding barbell with narrow grip above forehead. Bend elbows to lower bar toward forehead. Extend back up. Keep elbows pointing at ceiling throughout.
ex_080,Ankle Circles,"[""mobility""]","[""calves""]",[],"[""none""]","[""gym"",""home"",""outdoors""]",[],ankle_mobility,beginner,Stand on one foot (hold something for balance). Lift other foot and draw slow circles with your toes — clockwise then counter-clockwise. 10-15 each direction per foot.
ex_006,Push-Up,"[""general_fitness"",""home_workout"",""weight_loss"",""hypertrophy""]","[""chest""]","[""triceps"",""front_delts"",""core""]","[""none""]","[""gym"",""home"",""outdoors""]","[""wrist"",""shoulder""]",horizontal_push,beginner,"Start in a plank position with hands slightly wider than shoulder-width. Lower your body until your chest nearly touches the floor. Keep your body in a straight line from head to heels. Push back up to the starting position. If full push-ups are too difficult, start with knees on the ground."
ex_032,World's Greatest Stretch,"[""mobility"",""general_fitness""]","[""hip_flexors"",""thoracic_spine""]","[""hamstrings"",""shoulders""]","[""none""]","[""gym"",""home"",""outdoors""]",[],hip_mobility,beginner,"Step into a deep lunge. Place the hand on the same side as your front foot on the ground inside your foot. Rotate your other arm up toward the ceiling, opening your chest. Hold for a breath, then switch sides. Each side counts as one rep."
ex_042,Cable Chest Fly,"[""hypertrophy""]","[""chest""]","[""front_delts""]","[""machines""]","[""gym""]","[""shoulder""]",chest_isolation,intermediate,"Stand between cable stacks with handles at chest height. Step forward. Bring handles together in front of chest with slight elbow bend. Squeeze at center, return with control."
ex_045,Tricep Pushdown (Cable),"[""hypertrophy"",""general_fitness""]","[""triceps""]",[],"[""machines""]","[""gym""]",[],tricep_isolation,beginner,Stand facing cable machine with rope or bar attachment at top. Push down by extending elbows until arms are straight. Keep elbows pinned to sides. Return with control.
ex_048,Hip Thrust (Barbell),"[""strength"",""hypertrophy""]","[""glutes""]","[""hamstrings"",""core""]","[""barbell"",""bench""]","[""gym""]",[],hip_hinge,intermediate,"Sit with upper back against a bench, barbell across hips. Drive through heels to lift hips until body forms straight line from shoulders to knees. Squeeze glutes at top. Lower with control."
ex_063,Russian Twist,"[""general_fitness"",""home_workout""]","[""core""]",[],"[""none""]","[""gym"",""home"",""outdoors""]","[""lower_back""]",core_rotation,beginner,"Sit with knees bent, feet off floor, lean back slightly. Rotate torso side to side, touching the ground beside each hip. Keep core engaged throughout. Can hold a weight for added challenge."
ex_007,Barbell Deadlift,"[""strength"",""hypertrophy""]","[""hamstrings"",""glutes"",""lower_back""]","[""core"",""forearms"",""upper_back""]","[""barbell""]","[""gym""]","[""lower_back""]",hip_hinge,intermediate,"Stand with feet hip-width apart, bar over mid-foot. Hinge at hips and grip the bar just outside your knees. Flatten your back, brace your core, and drive through your feet to stand up. Keep the bar close to your body throughout. Reverse the movement to lower the bar back down with control."
ex_071,High Knees,"[""weight_loss"",""home_workout"",""general_fitness""]","[""hip_flexors"",""core""]","[""quadriceps"",""calves""]","[""none""]","[""gym"",""home"",""outdoors""]","[""knee""]",cardio_core,beginner,Stand tall. Run in place driving knees up to hip height with each step. Pump arms. Maintain quick pace. Keep core engaged and land softly.
ex_072,Jump Squats,"[""weight_loss"",""general_fitness""]","[""quadriceps"",""glutes""]","[""calves"",""core""]","[""none""]","[""gym"",""home"",""outdoors""]","[""knee"",""ankle"",""lower_back""]",cardio_core,intermediate,Start in squat position. Explode upward jumping as high as possible. Land softly bending knees to absorb impact. Immediately go into next rep.
ex_011,Dumbbell Shoulder Press,"[""strength"",""hypertrophy"",""general_fitness"",""home_workout""]","[""front_delts"",""side_delts""]","[""triceps"",""core""]","[""dumbbells""]","[""gym"",""home""]","[""shoulder""]",vertical_push,beginner,Sit or stand holding a dumbbell in each hand at shoulder height with palms facing forward. Press both dumbbells overhead until arms are fully extended. Lower back to shoulder height with control. Keep your core tight to avoid arching your back.
ex_015,Inverted Row,"[""home_workout"",""general_fitness""]","[""upper_back"",""lats""]","[""biceps"",""rear_delts"",""core""]","[""pull_up_bar""]","[""gym"",""home""]",[],horizontal_pull,beginner,"Set a bar at waist height (or use a sturdy table edge). Hang underneath with arms extended and body straight. Pull your chest to the bar by squeezing your shoulder blades together. Lower with control. The more horizontal your body, the harder it is."
ex_040,Thoracic Rotation (Seated),"[""mobility""]","[""thoracic_spine""]","[""core"",""shoulders""]","[""none""]","[""gym"",""home"",""outdoors""]",[],spine_mobility,beginner,"Sit on a chair or bench with feet flat. Cross arms over your chest. Keeping hips facing forward, slowly rotate your upper body to one side as far as comfortable. Hold briefly, return to center, then rotate to the other side. Each side counts as one rep. Move slowly and with control."
ex_064,Ab Wheel Rollout,"[""strength"",""hypertrophy""]","[""core""]","[""shoulders"",""lats""]","[""none""]","[""gym"",""home""]","[""lower_back"",""shoulder""]",core_stability,advanced,"Kneel with an ab wheel (or use a towel on smooth floor). Roll forward extending arms, keeping core tight and back flat. Go as far as you can control. Pull back to start using your abs."
ex_066,Superman Hold,"[""general_fitness"",""home_workout"",""mobility""]","[""lower_back"",""glutes""]","[""shoulders""]","[""none""]","[""gym"",""home"",""outdoors""]","[""lower_back""]",back_extension,beginner,"Lie face down with arms extended overhead. Simultaneously lift arms, chest, and legs off the floor. Hold briefly. Lower with control. Strengthens posterior chain."
