"Sprint 1: Foundation: Authentication, Onboarding, Health Metrics",,,,,,,,
"Sprint Goal: A new user can sign in (Google or Guest), complete onboarding, and see their calculated health metrics.",,,,,,,,
,,,,,,,,
Story ID,Epic,Feature,Story Title,User Story,Dependencies,Priority,Complexity,Sprint Goal
US-01.1.1,User Authentication,Google Login,Sign in with Google,"As a user, I want to sign in with my Google account so that I can access the app quickly without creating a new password.",Backend Auth service and User data model must exist before session issuance can be implemented.,High,Medium,"Foundation: Authentication, Onboarding, Health Metrics"
US-01.2.1,User Authentication,Guest Login,Continue as Guest,"As a user, I want to use the app as a guest so that I can try it out before committing to creating an account.",Depends on core User data model; upgrade path depends on Google Login (US-01.1.1) being implemented.,High,Small,"Foundation: Authentication, Onboarding, Health Metrics"
US-02.1.1,User Onboarding,Profile Data Collection,Complete profile onboarding,"As a user, I want to provide my basic profile and fitness information so that the app can personalize my workout recommendations.",Requires User Authentication (EPIC-01) to associate profile data with an identity.,High,Large,"Foundation: Authentication, Onboarding, Health Metrics"
US-03.1.1,Health Metrics,BMI Calculation,View my BMI,"As a user, I want to see my calculated BMI so that I understand a basic health reference point as I start using the app.",Depends on Profile Data Collection (US-02.1.1) providing height and weight.,High,Small,"Foundation: Authentication, Onboarding, Health Metrics"
US-03.2.1,Health Metrics,Maximum Heart Rate Calculation,View my Maximum Heart Rate,"As a user, I want to see my estimated Maximum Heart Rate so that I have a reference point for workout intensity.",Depends on Profile Data Collection (US-02.1.1) providing age.,High,Small,"Foundation: Authentication, Onboarding, Health Metrics"
US-03.3.1,Health Metrics,Training Zone Recommendation,View my Target Training Zone,"As a user, I want to see my recommended training heart-rate zone so that I know how hard to push during workouts.",Depends on Maximum Heart Rate Calculation (US-03.2.1).,High,Small,"Foundation: Authentication, Onboarding, Health Metrics"